{
  "schemaVersion": 1,
  "scanId": "00000000-0000-4000-8000-000000000003",
  "contributorId": "11111111-1111-4111-8111-111111111111",
  "appVersion": "1.4.0",
  "modelVersion": "1.2.0",
  "corners": [
    [
      0.1,
      0.1
    ],
    [
      0.9,
      0.12
    ],
    [
      0.88,
      0.9
    ],
    [
      0.12,
      0.88
    ]
  ],
  "cells": [
    {
      "digitProbs": [
        0.9,
        0.011111111111111112,
        0.011111111111111112,
        0.011111111111111112,
        0.011111111111111112,
        0.011111111111111112,
        0.011111111111111112,
        0.011111111111111112,
        0.011111111111111112,
        0.011111111111111112
      ],
      "kindProbs": [
        0.9,
        0.03333333333333333,
        0.03333333333333333,
        0.03333333333333333
      ],
      "finalDigit": 0,
      "finalKind": 0,
      "edited": false
    },
    {
      "digitProbs": [
        0.011111111111111112,
        0.011111111111111112,
        0.9,
        0.011111111111111112,
        0.011111111111111112,
        0.011111111111111112,
        0.011111111111111112,
        0.011111111111111112,
        0.011111111111111112,
        0.011111111111111112
      ],
      "kindProbs": [
        0.03333333333333333,
        0.9,
        0.03333333333333333,
        0.03333333333333333
      ],
      "finalDigit": 2,
      "finalKind": 1,
      "edited": false
    },
    {
      "digitProbs": [
        0.011111111111111112,
        0.011111111111111112,
        0.011111111111111112,
        0.9,
        0.011111111111111112,
        0.011111111111111112,
        0.011111111111111112,
        0.011111111111111112,
        0.011111111111111112,
        0.011111111111111112
      ],
      "kindProbs": [
        0.03333333333333333,
        0.9,
        0.03333333333333333,
        0.03333333333333333
      ],
      "finalDigit": 3,
      "finalKind": 1,
      "edited": false
    },
    {
      "digitProbs": [
        0.9,
        0.011111111111111112,
        0.011111111111111112,
        0.011111111111111112,
        0.011111111111111112,
        0.011111111111111112,
        0.011111111111111112,
        0.011111111111111112,
        0.011111111111111112,
        0.011111111111111112
      ],
      "kindProbs": [
        0.9,
        0.03333333333333333,
        0.03333333333333333,
        0.03333333333333333
      ],
      "finalDigit": 0,
      "finalKind": 0,
      "edited": false
    },
    {
      "digitProbs": [
        0.011111111111111112,
        0.011111111111111112,
        0.011111111111111112,
        0.011111111111111112,
        0.011111111111111112,
        0.9,
        0.011111111111111112,
        0.011111111111111112,
        0.011111111111111112,
        0.011111111111111112
      ],
      "kindProbs": [
        0.03333333333333333,
        0.9,
        0.03333333333333333,
        0.03333333333333333
      ],
      "finalDigit": 5,
      "finalKind": 1,
      "edited": false
    },
    {
      "digitProbs": [
        0.011111111111111112,
        0.011111111111111112,
        0.011111111111111112,
        0.011111111111111112,
        0.011111111111111112,
        0.011111111111111112,
        0.9,
        0.011111111111111112,
        0.011111111111111112,
        0.011111111111111112
      ],
      "kindProbs": [
        0.03333333333333333,
        0.9,
        0.03333333333333333,
        0.03333333333333333
      ],
      "finalDigit": 6,
      "finalKind": 1,
      "edited": false
    },
    {
      "digitProbs": [
        0.9,
        0.011111111111111112,
        0.011111111111111112,
        0.011111111111111112,
        0.011111111111111112,
        0.011111111111111112,
        0.011111111111111112,
        0.011111111111111112,
        0.011111111111111112,
        0.011111111111111112
      ],
      "kindProbs": [
        0.9,
        0.03333333333333333,
        0.03333333333333333,
        0.03333333333333333
      ],
      "finalDigit": 0,
      "finalKind": 0,
      "edited": false
    },
    {
      "digitProbs": [
        0.011111111111111112,
        0.011111111111111112,
        0.011111111111111112,
        0.011111111111111112,
        0.011111111111111112,
        0.011111111111111112,
        0.011111111111111112,
        0.011111111111111112,
        0.9,
        0.011111111111111112
      ],
      "kindProbs": [
        0.03333333333333333,
        0.9,
        0.03333333333333333,
        0.03333333333333333
      ],
      "finalDigit": 8,
      "finalKind": 1,
      "edited": false
    },
    {
      "digitProbs": [
        0.011111111111111112,
        0.011111111111111112,
        0.011111111111111112,
        0.011111111111111112,
        0.011111111111111112,
        0.011111111111111112,
        0.011111111111111112,
        0.011111111111111112,
        0.011111111111111112,
        0.9
      ],
      "kindProbs": [
        0.03333333333333333,
        0.9,
        0.03333333333333333,
        0.03333333333333333
      ],
      "finalDigit": 9,
      "finalKind": 1,
      "edited": false
    },
    {
      "digitProbs": [
        0.9,
        0.011111111111111112,
        0.011111111111111112,
        0.011111111111111112,
        0.011111111111111112,
        0.011111111111111112,
        0.011111111111111112,
        0.011111111111111112,
        0.011111111111111112,
        0.011111111111111112
      ],
      "kindProbs": [
        0.9,
        0.03333333333333333,
        0.03333333333333333,
        0.03333333333333333
      ],
      "finalDigit": 0,
      "finalKind": 0,
      "edited": false
    },
    {
      "digitProbs": [
        0.011111111111111112,
        0.011111111111111112,
        0.9,
        0.011111111111111112,
        0.011111111111111112,
        0.011111111111111112,
        0.011111111111111112,
        0.011111111111111112,
        0.011111111111111112,
        0.011111111111111112
      ],
      "kindProbs": [
        0.03333333333333333,
        0.9,
        0.03333333333333333,
        0.03333333333333333
      ],
      "finalDigit": 2,
      "finalKind": 1,
      "edited": false
    },
    {
      "digitProbs": [
        0.011111111111111112,
        0.011111111111111112,
        0.011111111111111112,
        0.9,
        0.011111111111111112,
        0.011111111111111112,
        0.011111111111111112,
        0.011111111111111112,
        0.011111111111111112,
        0.011111111111111112
      ],
      "kindProbs": [
        0.03333333333333333,
        0.9,
        0.03333333333333333,
        0.03333333333333333
      ],
      "finalDigit": 3,
      "finalKind": 1,
      "edited": false
    },
    {
      "digitProbs": [
        0.9,
        0.011111111111111112,
        0.011111111111111112,
        0.011111111111111112,
        0.011111111111111112,
        0.011111111111111112,
        0.011111111111111112,
        0.011111111111111112,
        0.011111111111111112,
        0.011111111111111112
      ],
      "kindProbs": [
        0.9,
        0.03333333333333333,
        0.03333333333333333,
        0.03333333333333333
      ],
      "finalDigit": 0,
      "finalKind": 0,
      "edited": false
    },
    {
      "digitProbs": [
        0.011111111111111112,
        0.011111111111111112,
        0.011111111111111112,
        0.011111111111111112,
        0.011111111111111112,
        0.9,
        0.011111111111111112,
        0.011111111111111112,
        0.011111111111111112,
        0.011111111111111112
      ],
      "kindProbs": [
        0.03333333333333333,
        0.9,
        0.03333333333333333,
        0.03333333333333333
      ],
      "finalDigit": 5,
      "finalKind": 1,
      "edited": false
    },
    {
      "digitProbs": [
        0.011111111111111112,
        0.011111111111111112,
        0.011111111111111112,
        0.011111111111111112,
        0.011111111111111112,
        0.011111111111111112,
        0.9,
        0.011111111111111112,
        0.011111111111111112,
        0.011111111111111112
      ],
      "kindProbs": [
        0.03333333333333333,
        0.9,
        0.03333333333333333,
        0.03333333333333333
      ],
      "finalDigit": 6,
      "finalKind": 1,
      "edited": false
    },
    {
      "digitProbs": [
        0.9,
        0.011111111111111112,
        0.011111111111111112,
        0.011111111111111112,
        0.011111111111111112,
        0.011111111111111112,
        0.011111111111111112,
        0.011111111111111112,
        0.011111111111111112,
        0.011111111111111112
      ],
      "kindProbs": [
        0.9,
        0.03333333333333333,
        0.03333333333333333,
        0.03333333333333333
      ],
      "finalDigit": 0,
      "finalKind": 0,
      "edited": false
    },
    {
      "digitProbs": [
        0.011111111111111112,
        0.011111111111111112,
        0.011111111111111112,
        0.011111111111111112,
        0.011111111111111112,
        0.011111111111111112,
        0.011111111111111112,
        0.011111111111111112,
        0.9,
        0.011111111111111112
      ],
      "kindProbs": [
        0.03333333333333333,
        0.9,
        0.03333333333333333,
        0.03333333333333333
      ],
      "finalDigit": 8,
      "finalKind": 1,
      "edited": false
    },
    {
      "digitProbs": [
        0.011111111111111112,
        0.011111111111111112,
        0.011111111111111112,
        0.011111111111111112,
        0.011111111111111112,
        0.011111111111111112,
        0.011111111111111112,
        0.011111111111111112,
        0.011111111111111112,
        0.9
      ],
      "kindProbs": [
        0.03333333333333333,
        0.9,
        0.03333333333333333,
        0.03333333333333333
      ],
      "finalDigit": 9,
      "finalKind": 1,
      "edited": false
    },
    {
      "digitProbs": [
        0.9,
        0.011111111111111112,
        0.011111111111111112,
        0.011111111111111112,
        0.011111111111111112,
        0.011111111111111112,
        0.011111111111111112,